{
  "$schema": "https://json-schema.org/draft/2020-12/schema",
  "$id": "https://github.com/mitiay7/senior-by-default/blob/main/skills/do/references/config.schema.json",
  "title": "senior-by-default config",
  "description": "Schema for .claude/do/config.json. `version` is recommended; if omitted, validators MUST default to 1 and emit a warning rather than fail (back-compat). All other fields are optional; defaults documented in config-schema.md. Explicit mismatches (e.g. `version: 2` with this schema) are hard failures. All path-bearing fields resolve relative to the directory containing this config file (not CWD).",
  "type": "object",
  "additionalProperties": false,
  "patternProperties": {
    "^_": {
      "description": "Underscore-prefixed keys are reserved for human comments (_description, _notes, _setup_notes, etc.) and ignored by validators."
    }
  },
  "properties": {
    "version": {
      "type": "integer",
      "const": 1,
      "default": 1,
      "description": "Schema version. Currently 1. Optional for back-compat: when omitted, validators MUST default to 1 and emit a warning rather than fail. This matches the documented behavior in references/config-validation.md."
    },

    "workspace": {
      "type": "object",
      "additionalProperties": false,
      "required": ["is_workspace", "repos"],
      "properties": {
        "is_workspace": { "type": "boolean", "const": true },
        "repos": {
          "type": "object",
          "minProperties": 1,
          "patternProperties": {
            "^[A-Za-z][A-Za-z0-9_-]*$": {
              "type": "object",
              "additionalProperties": false,
              "required": ["path", "scope_keywords"],
              "properties": {
                "path": { "type": "string", "minLength": 1 },
                "scope_keywords": {
                  "type": "array",
                  "items": { "type": "string", "minLength": 1 },
                  "minItems": 1
                }
              }
            }
          }
        }
      }
    },

    "issue_tracker": {
      "type": "object",
      "additionalProperties": false,
      "properties": {
        "type": { "enum": ["github", "gitlab", "none", "custom"] },
        "repo": { "type": "string" },
        "required_labels": { "type": "array", "items": { "type": "string" } },
        "optional_labels": { "type": "array", "items": { "type": "string" } },
        "domain_labels": { "type": "array", "items": { "type": "string" } },
        "commands": {
          "type": "object",
          "additionalProperties": false,
          "description": "Per-operation tracker commands. Each command (except close_keyword) accepts either argv array (preferred — argv-safe) or shell string (DEPRECATED — vulnerable to injection through user-controlled {title}/{labels}). See references/trackers.md §Security.",
          "properties": {
            "list_open": { "$ref": "#/$defs/trackerCommand" },
            "create":    { "$ref": "#/$defs/trackerCommand" },
            "view_body": { "$ref": "#/$defs/trackerCommand" },
            "edit_body": { "$ref": "#/$defs/trackerCommand" },
            "comment":   { "$ref": "#/$defs/trackerCommand" },
            "view_url":  { "$ref": "#/$defs/trackerCommand" },
            "close_keyword": { "type": "string" }
          }
        }
      },
      "allOf": [
        {
          "$comment": "Deliberately NO required:['type'] here — this branch must also fire when `type` is omitted: config-schema.md documents github as the default, so an omitted-type config IS a github config and must carry `repo` (every gh invocation in trackers.md passes --repo). Adding required:['type'] would make issue_tracker:{} schema-valid but runtime-broken.",
          "if": { "properties": { "type": { "enum": ["github", "gitlab"] } } },
          "then": { "required": ["repo"] }
        },
        {
          "$comment": "required:['type'] stops this branch firing vacuously when `type` is omitted — pre-fix, {repo:'o/r'} (a documented-valid github-default config) was rejected demanding a custom-tracker `commands` block.",
          "if": { "properties": { "type": { "const": "custom" } }, "required": ["type"] },
          "then": {
            "properties": { "commands": { "required": ["create"] } },
            "required": ["commands"]
          }
        }
      ]
    },

    "context_doc": {
      "type": "object",
      "additionalProperties": false,
      "required": ["path"],
      "properties": {
        "path": { "type": "string" },
        "sections": {
          "type": "object",
          "additionalProperties": {
            "oneOf": [
              { "type": "integer" },
              { "type": "string" }
            ]
          }
        },
        "required_for_finalize": { "type": "boolean" },
        "allow_main_push": { "type": "boolean" }
      }
    },

    "tech_debt_doc": { "type": "string" },

    "i18n": {
      "type": "object",
      "additionalProperties": false,
      "required": ["fn", "locale_files"],
      "properties": {
        "fn": { "type": "string", "minLength": 1 },
        "locale_files": {
          "type": "array",
          "items": { "type": "string" },
          "minItems": 1
        },
        "ui_extensions": {
          "type": "array",
          "items": { "type": "string", "pattern": "^\\." }
        }
      }
    },

    "ui_gate": {
      "oneOf": [
        { "type": "null" },
        {
          "type": "object",
          "additionalProperties": false,
          "patternProperties": { "^_": {} },
          "properties": {
            "infra_cmd": { "type": "string" },
            "dev_cmd": { "type": "string" },
            "url": { "type": "string", "format": "uri" },
            "login_script": { "type": ["string", "null"] }
          }
        }
      ],
      "description": "null = explicitly disable UI gate; object = enable with given commands."
    },

    "contract_gate": {
      "type": "object",
      "additionalProperties": false,
      "properties": {
        "frontend_types_path": { "type": "string" },
        "backend_handlers_path": { "type": "string" }
      }
    },

    "specialists": {
      "type": "object",
      "additionalProperties": {
        "type": "array",
        "items": { "type": "string", "pattern": "^[a-z0-9-]+:[a-z0-9-]+$" }
      }
    },

    "naming": {
      "type": "object",
      "additionalProperties": false,
      "properties": {
        "low": {
          "type": "object",
          "additionalProperties": false,
          "properties": {
            "worktree_suffix": { "type": "string" },
            "branch": { "type": "string" }
          }
        },
        "issue": {
          "type": "object",
          "additionalProperties": false,
          "properties": {
            "worktree_suffix": { "type": "string" },
            "branch": { "type": "string" },
            "ref_format": { "type": "string" }
          }
        }
      }
    },

    "issue_locale": {
      "type": "string",
      "pattern": "^[a-z]{2}(-[A-Z]{2})?$",
      "default": "en",
      "description": "Issue/PR body language: any ISO 639-1 code, optional region (en, ru, ja, ko, pt-BR). Pattern, NOT an enum — Phase 0 auto-init detects ru/ja/ko from $ARGUMENTS, and the pre-fix enum ['ru','en'] made auto-init exit 1 for every Japanese/Korean task."
    },

    "worktree": {
      "type": "object",
      "additionalProperties": true,
      "properties": {
        "base": { "type": "string" },
        "cleanup_cmd": { "type": "string" }
      }
    },

    "memory_path": { "type": "string" },

    "acceptance_extensions": {
      "type": "array",
      "items": {
        "type": "object",
        "additionalProperties": false,
        "required": ["trigger_keywords", "criterion"],
        "properties": {
          "trigger_keywords": {
            "type": "array",
            "items": { "type": "string", "minLength": 1 },
            "minItems": 1
          },
          "criterion": { "type": "string", "minLength": 1 }
        }
      }
    },

    "ci": {
      "type": "object",
      "additionalProperties": true,
      "properties": {
        "required": { "type": "boolean" },
        "wait_command": { "type": "string" },
        "status_command": { "type": "string" },
        "timeout_seconds": { "type": "integer", "minimum": 0 },
        "fail_action": { "enum": ["block", "warn"] }
      }
    },

    "auto_merge": {
      "type": "object",
      "additionalProperties": false,
      "properties": {
        "enabled": { "type": "boolean" },
        "method": { "enum": ["squash", "merge", "rebase"] },
        "delete_branch": { "type": "boolean" },
        "command": { "type": "string" }
      }
    },

    "pr_size": {
      "type": "object",
      "additionalProperties": false,
      "properties": {
        "warn_lines":  { "type": "integer", "minimum": 0 },
        "warn_files":  { "type": "integer", "minimum": 0 },
        "block_lines": { "type": "integer", "minimum": 0 },
        "block_files": { "type": "integer", "minimum": 0 },
        "auto_split":  { "type": "boolean", "description": "On a Phase 3.0 BLOCK, split delivery into a stack of sub-cap PRs (Phase 4.2.1) instead of halting. Default true; false reverts to the pre-0.11 draft-PR + blocked hard halt. Per-run override: --no-split." },
        "generated_paths": {
          "type": "array",
          "items": { "type": "string" },
          "description": "Globs (repo-root-relative) for machine-generated files committed to the repo, e.g. [\"openapi/*.json\", \"**/*.pb.go\"]. Their lines/files are excluded from the Phase 3.0 size verdict — a reviewer does not read them line by line; a drift check in CI keeps them correct. Both enforcement tiers read this same key (the pr-size-check wrapper measures, the PreToolUse hook delegates to it), so the gate and the hook cannot disagree. The excluded volume is always printed next to the counted volume. Glob syntax: * (not across /), ** (across /), ? (one non-/ char); a slash-free pattern matches at any depth; a trailing / means everything under. No character classes. Default: [] (nothing excluded)."
        }
      }
    },

    "stale_main": {
      "type": "object",
      "additionalProperties": false,
      "properties": {
        "warn_commits_behind":  { "type": "integer", "minimum": 0 },
        "block_commits_behind": { "type": "integer", "minimum": 0 },
        "auto_rebase": { "type": "boolean" }
      }
    },

    "self_review": {
      "type": "object",
      "additionalProperties": false,
      "properties": {
        "enabled": { "type": "boolean" }
      }
    },

    "codeowners": {
      "type": "object",
      "additionalProperties": false,
      "properties": {
        "enabled": { "type": "boolean" },
        "paths": { "type": "array", "items": { "type": "string" } },
        "agent_map": {
          "type": "object",
          "additionalProperties": { "type": "string" }
        }
      }
    },

    "wip_limit": {
      "oneOf": [
        { "type": "integer", "minimum": 1 },
        { "type": "null" }
      ],
      "description": "Opt-in. Omit/null disables the Phase 0 Step 1 WIP check entirely."
    },

    "concurrent_edit_check": {
      "type": "object",
      "additionalProperties": false,
      "properties": {
        "enabled": { "type": "boolean" },
        "lookback_days": { "type": "integer", "minimum": 1 }
      }
    },

    "feature_flags": {
      "type": "object",
      "additionalProperties": false,
      "properties": {
        "system": { "type": "string" },
        "registry_path": { "type": "string" },
        "naming_convention": { "enum": ["snake_case", "kebab-case", "camelCase", "SCREAMING_SNAKE"] },
        "default_state": { "enum": ["off", "on"] },
        "required_for_scopes": {
          "type": "array",
          "items": { "enum": ["frontend", "backend", "fullstack"] }
        }
      }
    },

    "adr": {
      "type": "object",
      "additionalProperties": false,
      "properties": {
        "dir": { "type": "string" },
        "min_complexity": { "enum": ["low", "medium", "high"] },
        "template_path": { "type": ["string", "null"] },
        "filename_format": { "type": "string" }
      }
    },

    "affected_graph": {
      "type": "object",
      "additionalProperties": false,
      "properties": {
        "tool": { "enum": ["nx", "turbo", "auto"] },
        "base_ref": { "type": "string" },
        "test_command_override": { "type": ["string", "null"] },
        "lint_command_override": { "type": ["string", "null"] }
      }
    },

    "security_scan": {
      "type": "object",
      "additionalProperties": false,
      "properties": {
        "enabled": { "type": "boolean" },
        "threshold": { "enum": ["low", "moderate", "high", "critical"] },
        "command_override_by_pm": {
          "type": "object",
          "additionalProperties": { "type": "string" }
        }
      }
    },

    "notifications": {
      "type": "object",
      "additionalProperties": false,
      "properties": {
        "slack_webhook": { "type": ["string", "null"] },
        "teams_webhook": { "type": ["string", "null"] },
        "events": {
          "type": "array",
          "items": { "enum": ["task_started", "task_blocked", "task_completed", "migration_proposed", "ci_failed"] }
        },
        "templates": {
          "type": "object",
          "additionalProperties": { "type": "string" }
        }
      }
    },

    "public_docs_dir": { "type": "string" },

    "lessons_doc": { "type": "string" },

    "metrics": {
      "oneOf": [
        { "type": "null" },
        {
          "type": "object",
          "additionalProperties": false,
          "properties": {
            "log_path": { "type": ["string", "null"] },
            "include_phase_durations": { "type": "boolean" },
            "tier": { "type": "integer", "minimum": 0, "maximum": 2 },
            "capture_failure_details": { "type": "boolean" },
            "capture_self_review_calibration": { "type": "boolean" },
            "capture_specialist_iterations": { "type": "boolean" },
            "max_string_length": { "type": "integer", "minimum": 50 }
          }
        }
      ],
      "description": "null = explicit telemetry opt-out (config-ensure-metrics respects it and never re-patches); object = enable. log_path: null keeps the block but disables JSONL emission entirely — the exact opt-out auto-init's _setup_notes advises. Both documented opt-outs were schema-INVALID pre-fix (same nullable shape as ui_gate)."
    },

    "postmortem": {
      "type": "object",
      "additionalProperties": false,
      "properties": {
        "trigger_keywords": { "type": "array", "items": { "type": "string" } },
        "branch_prefixes": { "type": "array", "items": { "type": "string" } },
        "template_path": { "type": ["string", "null"] }
      }
    }
  },

  "x-allow-extras": {
    "description": "Fields prefixed with `_` (e.g. `_notes`, `_setup_notes`, `_description`) are reserved for human comments and are tolerated by validators. Strict additionalProperties=false above intentionally rejects unknowns to catch typos; extend the schema rather than add ad-hoc keys."
  },

  "$defs": {
    "trackerCommand": {
      "oneOf": [
        {
          "type": "array",
          "minItems": 1,
          "items": { "type": "string" },
          "description": "PREFERRED: argv array. Each placeholder ({repo}, {title}, {N}, {body_file}, {labels}) occupies a dedicated argv slot — substitution happens after argv split, so user-controlled values cannot smuggle CLI flags."
        },
        {
          "type": "string",
          "not": {
            "pattern": "\\{(title|labels)\\}"
          },
          "description": "DEPRECATED string form, accepted ONLY for commands with no user-controlled placeholders. MUST NOT contain `{title}` or `{labels}` — those carry $ARGUMENTS-derived content and are vulnerable to shell injection regardless of `shlex.quote` fallback (the placeholder may already be wrapped in template-side quotes that user content can break out of). Commands carrying user content (typically `create`) MUST use the argv array form."
        }
      ]
    }
  }
}
